
===== Collected =====
2026-07-09T22:03:12Z

===== System =====
Linux onexplayer 6.17.7-ba29.fc43.x86_64 #1 SMP PREEMPT_DYNAMIC Wed Mar 25 07:35:02 UTC 2026 x86_64 GNU/Linux
product_name: ONEXPLAYER 2 PRO ARP23P
product_version: Version 1.0
board_name: ONEXPLAYER 2 PRO ARP23P
board_vendor: ONE-NETBOOK
bios_version: 1.05
bios_date: 07/31/2023

===== PCI audio devices =====
64:00.1 Audio device [0403]: Advanced Micro Devices, Inc. [AMD/ATI] Radeon High Definition Audio Controller [1002:1640]
64:00.6 Audio device [0403]: Advanced Micro Devices, Inc. [AMD] Ryzen HD Audio Controller [1022:15e3]

===== /dev/snd/by-path =====
total 0
lrwxrwxrwx. 1 root root 12 Jul  9 23:23 pci-0000:64:00.1 -> ../controlC0
lrwxrwxrwx. 1 root root 12 Jul  9 23:23 pci-0000:64:00.6 -> ../controlC1

===== Target audio path =====
TARGET_AUDIO_BY_PATH=/dev/snd/by-path/pci-0000:64:00.6
/dev/snd/controlC1

===== ALSA cards =====
 0 [Generic        ]: HDA-Intel - HD-Audio Generic
                      HD-Audio Generic at 0xdc588000 irq 96
 1 [Generic_1      ]: HDA-Intel - HD-Audio Generic
                      HD-Audio Generic at 0xdc580000 irq 97

===== Codec dumps =====
--- /proc/asound/card0/codec#0 ---
Codec: ATI R6xx HDMI
Address: 0
AFG Function Id: 0x1 (unsol 0)
Vendor Id: 0x1002aa01
Subsystem Id: 0x00aa0100
Revision Id: 0x100800
No Modem Function Group found
Default PCM:
    rates [0x70]: 32000 44100 48000
    bits [0x2]: 16
    formats [0x1]: PCM
Default Amp-In caps: N/A
Default Amp-Out caps: N/A
State of AFG node 0x01:
  Power states:  D0 D3 CLKSTOP EPSS
  Power: setting=D0, actual=D0, Clock-stop-OK
GPIO: io=0, o=0, i=0, unsolicited=0, wake=0
Node 0x02 [Audio Output] wcaps 0x221: Stereo Digital Stripe
  Converter: stream=0, channel=0
  Digital: Enabled
  Digital category: 0x0
  IEC Coding Type: 0x0
Node 0x03 [Pin Complex] wcaps 0x400381: Stereo Digital
  Pincap 0x00000094: OUT Detect HDMI
  Pin Default 0x185600f0: [Jack] Digital Out at Int HDMI
    Conn = Digital, Color = Unknown
    DefAssociation = 0xf, Sequence = 0x0
  Pin-ctls: 0x40: OUT
  Unsolicited: tag=00, enabled=0
  Connection: 1
     0x02
Node 0x04 [Audio Output] wcaps 0x221: Stereo Digital Stripe
  Converter: stream=0, channel=0
  Digital: Enabled
  Digital category: 0x0
  IEC Coding Type: 0x0
Node 0x05 [Pin Complex] wcaps 0x400381: Stereo Digital
  Pincap 0x00000094: OUT Detect HDMI
  Pin Default 0x185600f0: [Jack] Digital Out at Int HDMI
    Conn = Digital, Color = Unknown
    DefAssociation = 0xf, Sequence = 0x0
  Pin-ctls: 0x40: OUT
  Unsolicited: tag=00, enabled=0
  Connection: 1
     0x04
Node 0x06 [Audio Output] wcaps 0x221: Stereo Digital Stripe
  Converter: stream=0, channel=0
  Digital:
  Digital category: 0x0
  IEC Coding Type: 0x0
Node 0x07 [Pin Complex] wcaps 0x400381: Stereo Digital
  Pincap 0x00000094: OUT Detect HDMI
  Pin Default 0x185600f0: [Jack] Digital Out at Int HDMI
    Conn = Digital, Color = Unknown
    DefAssociation = 0xf, Sequence = 0x0
  Pin-ctls: 0x40: OUT
  Unsolicited: tag=00, enabled=0
  Connection: 1
     0x06
Node 0x08 [Audio Output] wcaps 0x221: Stereo Digital Stripe
  Converter: stream=0, channel=0
  Digital:
  Digital category: 0x0
  IEC Coding Type: 0x0
Node 0x09 [Pin Complex] wcaps 0x400381: Stereo Digital
  Pincap 0x00000094: OUT Detect HDMI
  Pin Default 0x185600f0: [Jack] Digital Out at Int HDMI
    Conn = Digital, Color = Unknown
    DefAssociation = 0xf, Sequence = 0x0
  Pin-ctls: 0x40: OUT
  Unsolicited: tag=00, enabled=0
  Connection: 1
     0x08
Node 0x0a [Audio Output] wcaps 0x221: Stereo Digital Stripe
  Converter: stream=0, channel=0
  Digital:
  Digital category: 0x0
  IEC Coding Type: 0x0
Node 0x0b [Pin Complex] wcaps 0x400381: Stereo Digital
  Pincap 0x00000094: OUT Detect HDMI
  Pin Default 0x185600f0: [Jack] Digital Out at Int HDMI
    Conn = Digital, Color = Unknown
    DefAssociation = 0xf, Sequence = 0x0
  Pin-ctls: 0x40: OUT
  Unsolicited: tag=00, enabled=0
  Connection: 1
     0x0a
--- /proc/asound/card1/codec#0 ---
Codec: Realtek ALC245
Address: 0
AFG Function Id: 0x1 (unsol 1)
Vendor Id: 0x10ec0245
Subsystem Id: 0x1f751602
Revision Id: 0x100001
No Modem Function Group found
Default PCM:
    rates [0x560]: 44100 48000 96000 192000
    bits [0xe]: 16 20 24
    formats [0x1]: PCM
Default Amp-In caps: N/A
Default Amp-Out caps: N/A
State of AFG node 0x01:
  Power states:  D0 D1 D2 D3 D3cold CLKSTOP EPSS
  Power: setting=D0, actual=D0
GPIO: io=3, o=0, i=0, unsolicited=1, wake=0
  IO[0]: enable=0, dir=0, wake=0, sticky=0, data=0, unsol=0
  IO[1]: enable=0, dir=0, wake=0, sticky=0, data=0, unsol=0
  IO[2]: enable=0, dir=0, wake=0, sticky=0, data=0, unsol=0
Node 0x02 [Audio Output] wcaps 0x41d: Stereo Amp-Out
  Control: name="Headphone Playback Volume", index=0, device=0
    ControlAmp: chs=3, dir=Out, idx=0, ofs=0
  Device: name="ALC245 Analog", type="Audio", device=0
  Amp-Out caps: ofs=0x57, nsteps=0x57, stepsize=0x02, mute=0
  Amp-Out vals:  [0x00 0x00]
  Converter: stream=5, channel=0
  PCM:
    rates [0x60]: 44100 48000
    bits [0xe]: 16 20 24
    formats [0x1]: PCM
  Power states:  D0 D1 D2 D3 EPSS
  Power: setting=D0, actual=D0
Node 0x03 [Audio Output] wcaps 0x41d: Stereo Amp-Out
  Control: name="Speaker Playback Volume", index=0, device=0
    ControlAmp: chs=3, dir=Out, idx=0, ofs=0
  Amp-Out caps: ofs=0x57, nsteps=0x57, stepsize=0x02, mute=0
  Amp-Out vals:  [0x4b 0x4b]
  Converter: stream=5, channel=0
  PCM:
    rates [0x60]: 44100 48000
    bits [0xe]: 16 20 24
    formats [0x1]: PCM
  Power states:  D0 D1 D2 D3 EPSS
  Power: setting=D0, actual=D0
Node 0x04 [Vendor Defined Widget] wcaps 0xf00000: Mono
Node 0x05 [Vendor Defined Widget] wcaps 0xf00000: Mono
Node 0x06 [Audio Output] wcaps 0x411: Stereo
  Converter: stream=0, channel=0
  PCM:
    rates [0x40]: 48000
    bits [0xe]: 16 20 24
    formats [0x1]: PCM
  Power states:  D0 D1 D2 D3 EPSS
  Power: setting=D0, actual=D0
Node 0x07 [Audio Input] wcaps 0x10051b: Stereo Amp-In
  Amp-In caps: ofs=0x17, nsteps=0x3f, stepsize=0x02, mute=1
  Amp-In vals:  [0x97 0x97]
  Converter: stream=0, channel=0
  SDI-Select: 0
  PCM:
    rates [0x560]: 44100 48000 96000 192000
    bits [0xe]: 16 20 24
    formats [0x1]: PCM
  Power states:  D0 D1 D2 D3 EPSS
  Power: setting=D0, actual=D0
  Connection: 1
     0x24
Node 0x08 [Audio Input] wcaps 0x10051b: Stereo Amp-In
  Control: name="Capture Volume", index=0, device=0
    ControlAmp: chs=3, dir=In, idx=0, ofs=0
  Control: name="Capture Switch", index=0, device=0
    ControlAmp: chs=3, dir=In, idx=0, ofs=0
  Device: name="ALC245 Analog", type="Audio", device=0
  Amp-In caps: ofs=0x17, nsteps=0x3f, stepsize=0x02, mute=1
  Amp-In vals:  [0x3f 0x3f]
  Converter: stream=1, channel=0
  SDI-Select: 0
  PCM:
    rates [0x560]: 44100 48000 96000 192000
    bits [0xe]: 16 20 24
    formats [0x1]: PCM
  Power states:  D0 D1 D2 D3 EPSS
  Power: setting=D0, actual=D0
  Connection: 1
     0x23
Node 0x09 [Audio Input] wcaps 0x10051b: Stereo Amp-In
  Amp-In caps: ofs=0x17, nsteps=0x3f, stepsize=0x02, mute=1
  Amp-In vals:  [0x97 0x97]
  Converter: stream=0, channel=0
  SDI-Select: 0
  PCM:
    rates [0x560]: 44100 48000 96000 192000
    bits [0xe]: 16 20 24
    formats [0x1]: PCM
  Power states:  D0 D1 D2 D3 EPSS
  Power: setting=D0, actual=D0
  Connection: 1
     0x22
Node 0x0a [Audio Input] wcaps 0x10051b: Stereo Amp-In
  Amp-In caps: ofs=0x17, nsteps=0x3f, stepsize=0x02, mute=1
  Amp-In vals:  [0x97 0x97]
  Converter: stream=0, channel=0
  SDI-Select: 0
  PCM:
    rates [0x40]: 48000
    bits [0xe]: 16 20 24
    formats [0x1]: PCM
  Power states:  D0 D1 D2 D3 EPSS
  Power: setting=D0, actual=D0
  Connection: 1
     0x25
Node 0x0b [Vendor Defined Widget] wcaps 0xf00000: Mono
Node 0x0c [Vendor Defined Widget] wcaps 0xf00000: Mono
Node 0x0d [Vendor Defined Widget] wcaps 0xf00000: Mono
Node 0x0e [Vendor Defined Widget] wcaps 0xf00000: Mono
Node 0x0f [Vendor Defined Widget] wcaps 0xf00000: Mono
Node 0x10 [Vendor Defined Widget] wcaps 0xf00000: Mono
Node 0x11 [Vendor Defined Widget] wcaps 0xf00000: Mono
Node 0x12 [Pin Complex] wcaps 0x40040b: Stereo Amp-In
  Control: name="Internal Mic Boost Volume", index=0, device=0
    ControlAmp: chs=3, dir=In, idx=0, ofs=0
  Amp-In caps: ofs=0x00, nsteps=0x03, stepsize=0x27, mute=0
  Amp-In vals:  [0x03 0x03]
  Pincap 0x00000020: IN
  Pin Default 0x90a60130: [Fixed] Mic at Int N/A
    Conn = Digital, Color = Unknown
    DefAssociation = 0x3, Sequence = 0x0
    Misc = NO_PRESENCE
  Pin-ctls: 0x20: IN
  Power states:  D0 D1 D2 D3 EPSS
  Power: setting=D0, actual=D0
Node 0x13 [Pin Complex] wcaps 0x40040b: Stereo Amp-In
  Amp-In caps: ofs=0x00, nsteps=0x03, stepsize=0x27, mute=0
  Amp-In vals:  [0x00 0x00]
  Pincap 0x00000020: IN
  Pin Default 0x40000000: [N/A] Line Out at Ext N/A
    Conn = Unknown, Color = Unknown
    DefAssociation = 0x0, Sequence = 0x0
  Pin-ctls: 0x00:
  Power states:  D0 D1 D2 D3 EPSS
  Power: setting=D0, actual=D0
Node 0x14 [Pin Complex] wcaps 0x40058d: Stereo Amp-Out
  Amp-Out caps: ofs=0x00, nsteps=0x00, stepsize=0x00, mute=1
  Amp-Out vals:  [0x80 0x80]
  Pincap 0x00010014: OUT EAPD Detect
  EAPD 0x2: EAPD
  Pin Default 0x411111f0: [N/A] Speaker at Ext Rear
    Conn = 1/8, Color = Black
    DefAssociation = 0xf, Sequence = 0x0
    Misc = NO_PRESENCE
  Pin-ctls: 0x00:
  Unsolicited: tag=00, enabled=0
  Power states:  D0 D1 D2 D3 EPSS
  Power: setting=D0, actual=D0
  Connection: 1
     0x02
Node 0x15 [Vendor Defined Widget] wcaps 0xf00000: Mono
Node 0x16 [Vendor Defined Widget] wcaps 0xf00000: Mono
Node 0x17 [Pin Complex] wcaps 0x40058d: Stereo Amp-Out
  Control: name="Speaker Playback Switch", index=0, device=0
    ControlAmp: chs=3, dir=Out, idx=0, ofs=0
  Amp-Out caps: ofs=0x00, nsteps=0x00, stepsize=0x00, mute=1
  Amp-Out vals:  [0x00 0x00]
  Pincap 0x0000001c: OUT HP Detect
  Pin Default 0x90170110: [Fixed] Speaker at Int N/A
    Conn = Analog, Color = Unknown
    DefAssociation = 0x1, Sequence = 0x0
    Misc = NO_PRESENCE
  Pin-ctls: 0x40: OUT
  Unsolicited: tag=00, enabled=0
  Power states:  D0 D1 D2 D3 EPSS
  Power: setting=D0, actual=D0
  Connection: 4
     0x02 0x03* 0x06 0x08
Node 0x18 [Pin Complex] wcaps 0x40048b: Stereo Amp-In
  Amp-In caps: ofs=0x00, nsteps=0x03, stepsize=0x27, mute=0
  Amp-In vals:  [0x00 0x00]
  Pincap 0x00000024: IN Detect
  Pin Default 0x411111f0: [N/A] Speaker at Ext Rear
    Conn = 1/8, Color = Black
    DefAssociation = 0xf, Sequence = 0x0
    Misc = NO_PRESENCE
  Pin-ctls: 0x00:
  Unsolicited: tag=00, enabled=0
  Power states:  D0 D1 D2 D3 EPSS
  Power: setting=D0, actual=D0
Node 0x19 [Pin Complex] wcaps 0x40048b: Stereo Amp-In
  Control: name="Mic Boost Volume", index=0, device=0
    ControlAmp: chs=3, dir=In, idx=0, ofs=0
  Amp-In caps: ofs=0x00, nsteps=0x03, stepsize=0x27, mute=0
  Amp-In vals:  [0x00 0x00]
  Pincap 0x00003724: IN Detect
    Vref caps: HIZ 50 GRD 80 100
  Pin Default 0x04a19040: [Jack] Mic at Ext Right
    Conn = 1/8, Color = Pink
    DefAssociation = 0x4, Sequence = 0x0
  Pin-ctls: 0x24: IN VREF_80
  Unsolicited: tag=02, enabled=1
  Power states:  D0 D1 D2 D3 EPSS
  Power: setting=D0, actual=D0
Node 0x1a [Pin Complex] wcaps 0x40048b: Stereo Amp-In
  Amp-In caps: ofs=0x00, nsteps=0x03, stepsize=0x27, mute=0
  Amp-In vals:  [0x00 0x00]
  Pincap 0x00003724: IN Detect
    Vref caps: HIZ 50 GRD 80 100
  Pin Default 0x411111f0: [N/A] Speaker at Ext Rear
    Conn = 1/8, Color = Black
    DefAssociation = 0xf, Sequence = 0x0
    Misc = NO_PRESENCE
  Pin-ctls: 0x00: VREF_HIZ
  Unsolicited: tag=00, enabled=0
  Power states:  D0 D1 D2 D3 EPSS
  Power: setting=D0, actual=D0
Node 0x1b [Pin Complex] wcaps 0x40058f: Stereo Amp-In Amp-Out
  Amp-In caps: ofs=0x00, nsteps=0x03, stepsize=0x27, mute=0
  Amp-In vals:  [0x00 0x00]
  Amp-Out caps: ofs=0x00, nsteps=0x00, stepsize=0x00, mute=1
  Amp-Out vals:  [0x80 0x80]
  Pincap 0x00013734: IN OUT EAPD Detect
    Vref caps: HIZ 50 GRD 80 100
  EAPD 0x2: EAPD
  Pin Default 0x411111f0: [N/A] Speaker at Ext Rear
    Conn = 1/8, Color = Black
    DefAssociation = 0xf, Sequence = 0x0
    Misc = NO_PRESENCE
  Pin-ctls: 0x00: VREF_HIZ
  Unsolicited: tag=00, enabled=0
  Power states:  D0 D1 D2 D3 EPSS
  Power: setting=D0, actual=D0
  Connection: 2
     0x02* 0x03
Node 0x1c [Vendor Defined Widget] wcaps 0xf00000: Mono
Node 0x1d [Pin Complex] wcaps 0x400400: Mono
  Pincap 0x00000020: IN
  Pin Default 0x4068ba35: [N/A] Modem Line at Ext N/A
    Conn = DIN, Color = UNKNOWN
    DefAssociation = 0x3, Sequence = 0x5
  Pin-ctls: 0x20: IN
  Power states:  D0 D1 D2 D3 EPSS
  Power: setting=D0, actual=D0
Node 0x1e [Pin Complex] wcaps 0x400501: Stereo
  Pincap 0x00000010: OUT
  Pin Default 0x411111f0: [N/A] Speaker at Ext Rear
    Conn = 1/8, Color = Black
    DefAssociation = 0xf, Sequence = 0x0
    Misc = NO_PRESENCE
  Pin-ctls: 0x40: OUT
  Power states:  D0 D1 D2 D3 EPSS
  Power: setting=D0, actual=D0
  Connection: 1
     0x06
Node 0x1f [Vendor Defined Widget] wcaps 0xf00000: Mono
Node 0x20 [Vendor Defined Widget] wcaps 0xf00040: Mono
  Processing caps: benign=0, ncoeff=142
Node 0x21 [Pin Complex] wcaps 0x40058d: Stereo Amp-Out
  Control: name="Headphone Playback Switch", index=0, device=0
    ControlAmp: chs=3, dir=Out, idx=0, ofs=0
  Amp-Out caps: ofs=0x00, nsteps=0x00, stepsize=0x00, mute=1
  Amp-Out vals:  [0x80 0x80]
  Pincap 0x0001001c: OUT HP EAPD Detect
  EAPD 0x2: EAPD
  Pin Default 0x04214020: [Jack] HP Out at Ext Right
    Conn = 1/8, Color = Green
    DefAssociation = 0x2, Sequence = 0x0
  Pin-ctls: 0xc0: OUT HP
  Unsolicited: tag=01, enabled=1
  Power states:  D0 D1 D2 D3 EPSS
  Power: setting=D0, actual=D0
  Connection: 2
     0x02* 0x03
Node 0x22 [Audio Mixer] wcaps 0x20010b: Stereo Amp-In
  Amp-In caps: ofs=0x00, nsteps=0x00, stepsize=0x00, mute=1
  Amp-In vals:  [0x80 0x80] [0x80 0x80] [0x80 0x80] [0x80 0x80] [0x80 0x80]
  Connection: 5
     0x19 0x1a 0x1b 0x1d 0x13
Node 0x23 [Audio Mixer] wcaps 0x20010b: Stereo Amp-In
  Amp-In caps: ofs=0x00, nsteps=0x00, stepsize=0x00, mute=1
  Amp-In vals:  [0x80 0x80] [0x80 0x80] [0x80 0x80] [0x80 0x80] [0x00 0x00]
  Connection: 5
     0x19 0x1a 0x1b 0x1d 0x12
Node 0x24 [Audio Selector] wcaps 0x300101: Stereo
  Connection: 3
     0x12* 0x13 0x18
Node 0x25 [Audio Selector] wcaps 0x300101: Stereo
  Connection: 2
     0x12* 0x13

===== Kernel HDA messages =====
[    0.556503] ACPI: \_SB_.PCI0.GP17.HDAU.PWRS: New power resource
[   12.292049] snd_hda_intel 0000:64:00.1: enabling device (0000 -> 0002)
[   12.292150] snd_hda_intel 0000:64:00.1: Handle vga_switcheroo audio client
[   12.292230] snd_hda_intel 0000:64:00.6: enabling device (0000 -> 0002)
[   12.447115] snd_hda_intel 0000:64:00.1: bound 0000:64:00.0 (ops amdgpu_dm_audio_component_bind_ops [amdgpu])
[   12.503511] snd_hda_codec_alc269 hdaudioC1D0: autoconfig for ALC245: line_outs=1 (0x17/0x0/0x0/0x0/0x0) type:speaker
[   12.503519] snd_hda_codec_alc269 hdaudioC1D0:    speaker_outs=0 (0x0/0x0/0x0/0x0/0x0)
[   12.503523] snd_hda_codec_alc269 hdaudioC1D0:    hp_outs=1 (0x21/0x0/0x0/0x0/0x0)
[   12.503526] snd_hda_codec_alc269 hdaudioC1D0:    mono: mono_out=0x0
[   12.503528] snd_hda_codec_alc269 hdaudioC1D0:    inputs:
[   12.503531] snd_hda_codec_alc269 hdaudioC1D0:      Internal Mic=0x12
[   12.503534] snd_hda_codec_alc269 hdaudioC1D0:      Mic=0x19
[   28.637456] Modules linked in: uinput snd_seq_dummy rfcomm snd_hrtimer acpi_call des3_ede_x86_64 des_generic libdes md4 nf_conntrack_netbios_ns nf_conntrack_broadcast nft_fib_inet nft_fib_ipv4 nft_fib_ipv6 nft_fib nft_reject_inet nf_reject_ipv4 nf_reject_ipv6 nft_reject nft_ct nft_chain_nat nf_nat nf_conntrack nf_defrag_ipv6 nf_defrag_ipv4 nf_tables qrtr bnep sunrpc binfmt_misc vfat fat snd_hda_codec_alc269 snd_hda_scodec_component snd_hda_codec_realtek_lib intel_rapl_msr snd_hda_codec_atihdmi amd_atl spd5118 intel_rapl_common snd_hda_codec_generic snd_hda_codec_hdmi snd_hda_intel edac_mce_amd oxpec kvm_amd iwlmvm snd_hda_codec bmi160_i2c bmi160_core snd_hda_core btusb kvm snd_intel_dspcfg mac80211 btrtl snd_intel_sdw_acpi btintel snd_hwdep wmi_bmof rapl libarc4 btbcm pcspkr btmtk snd_seq bluetooth k10temp xpad iwlwifi snd_seq_device snd_pcm bmi260_i2c cfg80211 i2c_piix4 bmi260_core snd_timer i2c_smbus snd industrialio_triggered_buffer rfkill soundcore kfifo_buf joydev industrialio amd_pmc tcp_bbr hid_playstation
[   28.639125] Modules linked in: uinput snd_seq_dummy rfcomm snd_hrtimer acpi_call des3_ede_x86_64 des_generic libdes md4 nf_conntrack_netbios_ns nf_conntrack_broadcast nft_fib_inet nft_fib_ipv4 nft_fib_ipv6 nft_fib nft_reject_inet nf_reject_ipv4 nf_reject_ipv6 nft_reject nft_ct nft_chain_nat nf_nat nf_conntrack nf_defrag_ipv6 nf_defrag_ipv4 nf_tables qrtr bnep sunrpc binfmt_misc vfat fat snd_hda_codec_alc269 snd_hda_scodec_component snd_hda_codec_realtek_lib intel_rapl_msr snd_hda_codec_atihdmi amd_atl spd5118 intel_rapl_common snd_hda_codec_generic snd_hda_codec_hdmi snd_hda_intel edac_mce_amd oxpec kvm_amd iwlmvm snd_hda_codec bmi160_i2c bmi160_core snd_hda_core btusb kvm snd_intel_dspcfg mac80211 btrtl snd_intel_sdw_acpi btintel snd_hwdep wmi_bmof rapl libarc4 btbcm pcspkr btmtk snd_seq bluetooth k10temp xpad iwlwifi snd_seq_device snd_pcm bmi260_i2c cfg80211 i2c_piix4 bmi260_core snd_timer i2c_smbus snd industrialio_triggered_buffer rfkill soundcore kfifo_buf joydev industrialio amd_pmc tcp_bbr hid_playstation
[   28.640236] Modules linked in: uinput snd_seq_dummy rfcomm snd_hrtimer acpi_call des3_ede_x86_64 des_generic libdes md4 nf_conntrack_netbios_ns nf_conntrack_broadcast nft_fib_inet nft_fib_ipv4 nft_fib_ipv6 nft_fib nft_reject_inet nf_reject_ipv4 nf_reject_ipv6 nft_reject nft_ct nft_chain_nat nf_nat nf_conntrack nf_defrag_ipv6 nf_defrag_ipv4 nf_tables qrtr bnep sunrpc binfmt_misc vfat fat snd_hda_codec_alc269 snd_hda_scodec_component snd_hda_codec_realtek_lib intel_rapl_msr snd_hda_codec_atihdmi amd_atl spd5118 intel_rapl_common snd_hda_codec_generic snd_hda_codec_hdmi snd_hda_intel edac_mce_amd oxpec kvm_amd iwlmvm snd_hda_codec bmi160_i2c bmi160_core snd_hda_core btusb kvm snd_intel_dspcfg mac80211 btrtl snd_intel_sdw_acpi btintel snd_hwdep wmi_bmof rapl libarc4 btbcm pcspkr btmtk snd_seq bluetooth k10temp xpad iwlwifi snd_seq_device snd_pcm bmi260_i2c cfg80211 i2c_piix4 bmi260_core snd_timer i2c_smbus snd industrialio_triggered_buffer rfkill soundcore kfifo_buf joydev industrialio amd_pmc tcp_bbr hid_playstation

===== Realtek COEF registers (node 0x20) =====
--- COEF dump for /dev/snd/hwC1D0 (Realtek ALC245) via /dev/snd/by-path/pci-0000:64:00.6 ---
saved coef index = 0x2a
coef 0x00 = 0x5011
coef 0x01 = 0xaaaa
coef 0x02 = 0x8aaa
coef 0x03 = 0x2
coef 0x04 = 0xaa09
coef 0x05 = 0x700
coef 0x06 = 0x6115
coef 0x07 = 0x200
coef 0x08 = 0x6a0c
coef 0x09 = 0xa983
coef 0x0a = 0x7770
coef 0x0b = 0x7770
coef 0x0c = 0x1ef
coef 0x0d = 0xa023
coef 0x0e = 0x65c0
coef 0x0f = 0x2c2
coef 0x10 = 0x220
coef 0x11 = 0x0
coef 0x12 = 0x0
coef 0x13 = 0x2200
coef 0x14 = 0x0
coef 0x15 = 0x0
coef 0x16 = 0x0
coef 0x17 = 0x0
coef 0x18 = 0x0
coef 0x19 = 0xe11
coef 0x1a = 0x8d0b
coef 0x1b = 0x4a6b
coef 0x1c = 0x0
coef 0x1d = 0x0
coef 0x1e = 0x0
coef 0x1f = 0x0
coef 0x20 = 0x1000
coef 0x21 = 0x0
coef 0x22 = 0x0
coef 0x23 = 0x8804
coef 0x24 = 0x10
coef 0x25 = 0x0
coef 0x26 = 0xf10b
coef 0x27 = 0x0
coef 0x28 = 0x5c
coef 0x29 = 0xb003
coef 0x2a = 0x0
coef 0x2b = 0xffff
coef 0x2c = 0xf00
coef 0x2d = 0x1f4f
coef 0x2e = 0x290e
coef 0x2f = 0xef57
coef 0x30 = 0x9007
coef 0x31 = 0x80c0
coef 0x32 = 0x50a8
coef 0x33 = 0x8580
coef 0x34 = 0xa281
coef 0x35 = 0x8daa
coef 0x36 = 0x57d7
coef 0x37 = 0xfe05
coef 0x38 = 0x4909
coef 0x39 = 0x330a
coef 0x3a = 0x10
coef 0x3b = 0x60d9
coef 0x3c = 0xf135
coef 0x3d = 0xc2ba
coef 0x3e = 0xa928
coef 0x3f = 0x0
coef 0x40 = 0x8800
coef 0x41 = 0x0
coef 0x42 = 0x2000
coef 0x43 = 0x3d97
coef 0x44 = 0x4900
coef 0x45 = 0x9009
coef 0x46 = 0x4
coef 0x47 = 0xa47a
coef 0x48 = 0xd049
coef 0x49 = 0x49
coef 0x4a = 0xa0a0
coef 0x4b = 0x0
coef 0x4c = 0x65c
coef 0x4d = 0x7fff
coef 0x4e = 0x7fff
coef 0x4f = 0x0
coef 0x50 = 0x0
coef 0x51 = 0x5f5f
coef 0x52 = 0x100
coef 0x53 = 0x0
coef 0x54 = 0x0
coef 0x55 = 0x0
coef 0x56 = 0xfd00
coef 0x57 = 0x0
coef 0x58 = 0x0
coef 0x59 = 0x0
coef 0x5a = 0x0
coef 0x5b = 0x777
coef 0x5c = 0x0
coef 0x5d = 0x6000
coef 0x5e = 0x4000
coef 0x5f = 0x6200
coef 0x60 = 0x0
coef 0x61 = 0x0
coef 0x62 = 0x0
coef 0x63 = 0xc000
coef 0x64 = 0x0
coef 0x65 = 0x0
coef 0x66 = 0x0
coef 0x67 = 0x3000
coef 0x68 = 0x1
coef 0x69 = 0x0
coef 0x6a = 0x0
coef 0x6b = 0xa394
coef 0x6c = 0x7fff
coef 0x6d = 0x7000
coef 0x6e = 0x0
coef 0x6f = 0x0
coef 0x70 = 0x0
coef 0x71 = 0x0
coef 0x72 = 0x0
coef 0x73 = 0x0
coef 0x74 = 0x0
coef 0x75 = 0x78c3
coef 0x76 = 0xf200
coef 0x77 = 0x0
coef 0x78 = 0x0
coef 0x79 = 0x0
coef 0x7a = 0x0
coef 0x7b = 0x0
coef 0x7c = 0x0
coef 0x7d = 0x0
coef 0x7e = 0x0
coef 0x7f = 0x0
coef 0x80 = 0x0
coef 0x81 = 0x0
coef 0x82 = 0x0
coef 0x83 = 0x0
coef 0x84 = 0x0
coef 0x85 = 0x0
coef 0x86 = 0x0
coef 0x87 = 0x0
coef 0x88 = 0x0
coef 0x89 = 0x0
coef 0x8a = 0x0
coef 0x8b = 0x0
coef 0x8c = 0xff80
coef 0x8d = 0x0
coef 0x8e = 0x1
coef 0x8f = 0x0
coef 0x90 = 0x0
coef 0x91 = 0x0
coef 0x92 = 0x0
coef 0x93 = 0x0
coef 0x94 = 0x0
coef 0x95 = 0x0
coef 0x96 = 0x0
coef 0x97 = 0x0
coef 0x98 = 0x0
coef 0x99 = 0x0
coef 0x9a = 0x0
coef 0x9b = 0x0
coef 0x9c = 0x0
coef 0x9d = 0x0
coef 0x9e = 0x0
coef 0x9f = 0x0
coef 0xa0 = 0x0
coef 0xa1 = 0x0
coef 0xa2 = 0x0
coef 0xa3 = 0x0
coef 0xa4 = 0x0
coef 0xa5 = 0x0
coef 0xa6 = 0x0
coef 0xa7 = 0x0
coef 0xa8 = 0x0
coef 0xa9 = 0x0
coef 0xaa = 0x0
coef 0xab = 0x0
coef 0xac = 0x0
coef 0xad = 0x0
coef 0xae = 0x0
coef 0xaf = 0x0
coef 0xb0 = 0x0
coef 0xb1 = 0x0
coef 0xb2 = 0x0
coef 0xb3 = 0x0
coef 0xb4 = 0x0
coef 0xb5 = 0x0
coef 0xb6 = 0x0
coef 0xb7 = 0x0
coef 0xb8 = 0x0
coef 0xb9 = 0x0
coef 0xba = 0x0
coef 0xbb = 0x0
coef 0xbc = 0x0
coef 0xbd = 0x0
coef 0xbe = 0x0
coef 0xbf = 0x0
coef 0xc0 = 0x0
coef 0xc1 = 0x0
coef 0xc2 = 0x0
coef 0xc3 = 0x0
coef 0xc4 = 0x0
coef 0xc5 = 0x0
coef 0xc6 = 0x0
coef 0xc7 = 0x0
coef 0xc8 = 0x0
coef 0xc9 = 0x0
coef 0xca = 0x0
coef 0xcb = 0x0
coef 0xcc = 0x0
coef 0xcd = 0x0
coef 0xce = 0x0
coef 0xcf = 0x0
coef 0xd0 = 0x0
coef 0xd1 = 0x0
coef 0xd2 = 0x0
coef 0xd3 = 0x0
coef 0xd4 = 0x0
coef 0xd5 = 0x0
coef 0xd6 = 0x0
coef 0xd7 = 0x0
coef 0xd8 = 0x0
coef 0xd9 = 0x0
coef 0xda = 0x0
coef 0xdb = 0x0
coef 0xdc = 0x0
coef 0xdd = 0x0
coef 0xde = 0x0
coef 0xdf = 0x0
coef 0xe0 = 0x0
coef 0xe1 = 0x0
coef 0xe2 = 0x0
coef 0xe3 = 0x0
coef 0xe4 = 0x0
coef 0xe5 = 0x0
coef 0xe6 = 0x0
coef 0xe7 = 0x0
coef 0xe8 = 0x0
coef 0xe9 = 0x0
coef 0xea = 0x0
coef 0xeb = 0x0
coef 0xec = 0x0
coef 0xed = 0x0
coef 0xee = 0x0
coef 0xef = 0x0
coef 0xf0 = 0x0
coef 0xf1 = 0x0
coef 0xf2 = 0x0
coef 0xf3 = 0x0
coef 0xf4 = 0x0
coef 0xf5 = 0x0
coef 0xf6 = 0x0
coef 0xf7 = 0x0
coef 0xf8 = 0x0
coef 0xf9 = 0x0
coef 0xfa = 0x0
coef 0xfb = 0x0
coef 0xfc = 0x0
coef 0xfd = 0x0
coef 0xfe = 0x0
coef 0xff = 0x0
restored coef index = 0x2a
